"Story","Title","Result","Date","Stability","Duration (s)"
"Register","user tidak dapat register karena menggunakan email yang sudah terdaftar","ERROR","2023-05-09T22:19:42.2822162+07:00[Asia/Jakarta]","0.0","19.23"
"Register","user tidak dapat register karena tidak mengisi field nama lengkap","ERROR","2023-05-09T22:20:01.5302661+07:00[Asia/Jakarta]","0.0","26.59"
"Register","user tidak dapat register karena tidak mengisi field nama email","SUCCESS","2023-05-09T22:20:28.1345282+07:00[Asia/Jakarta]","0.0","17.97"
"Register","user tidak dapat register karena tidak mengisi field password","SUCCESS","2023-05-09T22:20:46.1235937+07:00[Asia/Jakarta]","0.0","19.54"
"Register","user dapat register karena semua field terisi dan data yang valid","SUCCESS","2023-05-09T22:21:05.67886+07:00[Asia/Jakarta]","0.0","21.32"
